{
  "$schema": "https://json-schema.org/draft/2020-12/schema",
  "$id": "https://schemas.kurobara.invalid/schemas/events/run-queued/1.0.0",
  "title": "RunQueuedEvent",
  "description": "Minimal redacted public projection of the durable RunQueued fact.",
  "type": "object",
  "additionalProperties": false,
  "required": [
    "public_event_id",
    "type",
    "schema_version",
    "run_id",
    "run_plan_id",
    "workspace_id",
    "sequence",
    "occurred_at_ms",
    "actor_id",
    "correlation_id"
  ],
  "properties": {
    "public_event_id": { "type": "string", "minLength": 1 },
    "type": { "const": "dev.kurobara.run.queued.v1" },
    "schema_version": { "const": "1.0.0" },
    "run_id": { "type": "string", "minLength": 1 },
    "run_plan_id": { "type": "string", "minLength": 1 },
    "workspace_id": { "type": "string", "minLength": 1 },
    "sequence": { "const": 1 },
    "occurred_at_ms": { "type": "integer", "minimum": 0 },
    "actor_id": { "type": "string", "minLength": 1 },
    "correlation_id": { "type": "string", "minLength": 1 }
  },
  "x-kurobara-schema-version": "1.0.0",
  "x-kurobara-owner": "application.runs",
  "x-kurobara-data-classification": "internal",
  "x-kurobara-redaction": "public-safe-fields-only",
  "x-kurobara-publication-status": "local-development-only"
}
